{"abi_limits":{"abi_limits_raw_sha256":"e709ee450e6a57323740ae547b3ccfbc69f1e397ea6116afc0cfb658859103c2","max_mtu_bytes":65535,"max_payload_bytes":18446744073709551615,"max_pipe_inflight_transit_units":1073741823,"max_plan_file_bytes":67108864,"max_result_file_bytes":134217728,"min_mtu_bytes":1},"capability_schema_id":"htsim-ocs-capabilities/v1","dependency_modes":["explicit_group_dag","global_step_barrier"],"execution_modes":["exact_coalesced","full_packet"],"operation_event_schema":{"raw_sha256":"5b3d2424233220ce28669afa1f912a4b89b700930ba2c2180dd8f66e8e98277d","schema_id":"htsim-ocs-operation-event/v1"},"path_preparation_policies":["overlap_earliest","static_preinstalled","step_lockstep"],"plan_schema":{"raw_sha256":"b37ce8b5a87127b84967d990bd0055ef0c6cd5b5be20139e0fef05aac3f17d78","schema_id":"swot-execution-plan/v2"},"result_schema":{"raw_sha256":"857e2d8d9f91bd17fd140326b832a542e95f323cd243a6bb986ef84ef1390a86","schema_id":"swot-simulation-result/v2"},"schema_version":"overlap4ocs-htsim-capabilities-static-projection/v1","transport_modes":["paper_exact"]}
